{
  "schema_version": "1.0",
  "id": "demo-household",
  "name": "Demo Household",
  "as_of": "2026-09-21",
  "base_currency": "AUD",
  "synthetic": true,
  "entities": [
    {
      "id": "household",
      "label": "Demo household beneficial ownership",
      "type": "household"
    },
    {
      "id": "pension-wrapper",
      "label": "Demo retirement account",
      "type": "account"
    }
  ],
  "assets": [
    {
      "id": "cash",
      "label": "Cash reserve",
      "class": "cash",
      "value": "120000",
      "currency": "AUD",
      "ownership_share": "1",
      "owner_id": "household",
      "wrapper": "direct",
      "liquidity_days": 0,
      "restriction": "none",
      "investable": true,
      "liquidation_haircut": "0",
      "valuation_basis": "market",
      "valuation_date": "2026-09-21",
      "evidence_id": "demo-input"
    },
    {
      "id": "global-equities",
      "label": "Public equity basket",
      "class": "equity",
      "value": "220000",
      "currency": "AUD",
      "ownership_share": "1",
      "owner_id": "household",
      "wrapper": "direct",
      "liquidity_days": 2,
      "restriction": "none",
      "investable": true,
      "liquidation_haircut": "0.10",
      "valuation_basis": "market",
      "valuation_date": "2026-09-21",
      "evidence_id": "demo-input"
    },
    {
      "id": "bonds",
      "label": "Bond basket",
      "class": "bond",
      "value": "100000",
      "currency": "AUD",
      "ownership_share": "1",
      "owner_id": "household",
      "wrapper": "direct",
      "liquidity_days": 2,
      "restriction": "none",
      "investable": true,
      "liquidation_haircut": "0.02",
      "valuation_basis": "market",
      "valuation_date": "2026-09-21",
      "evidence_id": "demo-input"
    },
    {
      "id": "home",
      "label": "Primary residence",
      "class": "real_estate",
      "value": "1200000",
      "currency": "AUD",
      "ownership_share": "1",
      "owner_id": "household",
      "wrapper": "direct",
      "liquidity_days": 180,
      "restriction": "none",
      "investable": false,
      "liquidation_haircut": "0.10",
      "valuation_basis": "market",
      "valuation_date": "2026-09-21",
      "evidence_id": "demo-input"
    },
    {
      "id": "business",
      "label": "Private operating business equity",
      "class": "private_business",
      "value": "600000",
      "currency": "AUD",
      "ownership_share": "1",
      "owner_id": "household",
      "wrapper": "direct",
      "liquidity_days": 365,
      "restriction": "none",
      "investable": false,
      "liquidation_haircut": "0.40",
      "valuation_basis": "equity",
      "valuation_date": "2026-09-21",
      "evidence_id": "demo-input"
    },
    {
      "id": "pension",
      "label": "Equity holdings inside pension",
      "class": "equity",
      "value": "180000",
      "currency": "AUD",
      "ownership_share": "1",
      "owner_id": "pension-wrapper",
      "wrapper": "pension",
      "liquidity_days": 3650,
      "restriction": "locked",
      "investable": false,
      "liquidation_haircut": "0",
      "valuation_basis": "market",
      "valuation_date": "2026-09-21",
      "evidence_id": "demo-input"
    },
    {
      "id": "private-credit",
      "label": "Private credit fund",
      "class": "private_credit",
      "value": "80000",
      "currency": "AUD",
      "ownership_share": "1",
      "owner_id": "household",
      "wrapper": "direct",
      "liquidity_days": 365,
      "restriction": "locked",
      "investable": false,
      "liquidation_haircut": "0.25",
      "valuation_basis": "market",
      "valuation_date": "2026-09-21",
      "evidence_id": "demo-input"
    }
  ],
  "liabilities": [
    {
      "id": "mortgage",
      "label": "Home mortgage principal",
      "type": "mortgage",
      "value": "700000",
      "currency": "AUD",
      "ownership_share": "1",
      "owner_id": "household",
      "valuation_date": "2026-09-21",
      "evidence_id": "demo-input"
    }
  ],
  "cashflows": [
    {
      "id": "salary",
      "label": "Net salary",
      "direction": "in",
      "amount": "8000",
      "category": "salary",
      "nature": "stable",
      "recurrence": "monthly",
      "start_date": "2026-10-01",
      "end_date": null,
      "currency": "AUD",
      "evidence_id": "demo-input",
      "amount_basis": "household_net_after_tax"
    },
    {
      "id": "business-income",
      "label": "Net business distributions",
      "direction": "in",
      "amount": "5000",
      "category": "business_income",
      "nature": "variable",
      "recurrence": "monthly",
      "start_date": "2026-10-01",
      "end_date": null,
      "currency": "AUD",
      "evidence_id": "demo-input",
      "amount_basis": "household_net_after_tax"
    },
    {
      "id": "living",
      "label": "Living expenses",
      "direction": "out",
      "amount": "7500",
      "category": "living_expense",
      "nature": "stable",
      "recurrence": "monthly",
      "start_date": "2026-10-01",
      "end_date": null,
      "currency": "AUD",
      "evidence_id": "demo-input",
      "amount_basis": "household_net_after_tax"
    },
    {
      "id": "debt-service",
      "label": "Mortgage payment, entered once",
      "direction": "out",
      "amount": "3500",
      "category": "debt_service",
      "nature": "stable",
      "recurrence": "monthly",
      "start_date": "2026-10-01",
      "end_date": null,
      "currency": "AUD",
      "evidence_id": "demo-input",
      "amount_basis": "household_net_after_tax"
    },
    {
      "id": "school",
      "label": "Planned school payment",
      "direction": "out",
      "amount": "24000",
      "category": "school_fees",
      "nature": "one_off",
      "recurrence": "one_off",
      "start_date": "2027-03-15",
      "end_date": null,
      "currency": "AUD",
      "evidence_id": "demo-input",
      "amount_basis": "household_net_after_tax"
    },
    {
      "id": "capital-call",
      "label": "Assumed fund capital call",
      "direction": "out",
      "amount": "50000",
      "category": "capital_call",
      "nature": "one_off",
      "recurrence": "one_off",
      "start_date": "2027-06-01",
      "end_date": null,
      "currency": "AUD",
      "evidence_id": "demo-input",
      "amount_basis": "household_net_after_tax"
    }
  ],
  "fx": {},
  "evidence": [
    {
      "id": "demo-input",
      "kind": "synthetic",
      "source": "Bundled fictional fixture; not a real household",
      "as_of": "2026-09-21",
      "note": "All values and forward events are invented for deterministic tests."
    }
  ],
  "risk_preferences": {
    "willingness": "medium",
    "note": "Synthetic preference only; no numeric risk-capacity score or suitability conclusion."
  },
  "notes": "Cashflows are hypothetical household-attributable after-tax amounts. Business value is equity value; company debt is already reflected. No operating-company assets are counted separately."
}
